,text,sentiment,score,emojis
211,They really cracked how to make an informative and fun video about a daunting topic!,pos,0.99974173,":thumbsup:, :clap:, :blush:, :v:, :ok_hand:, :expressionless:, :hand:, :smile:, :angry:, :relaxed:"
212,Amazing teacher..,pos,0.98559606,":muscle:, :thumbsup:, :sleeping:, :raised_hands:, :smile:, :pray:, :sunglasses:, :facepunch:, :v:, :grin:"
213,Am I the only one who noticed that he had a Tile on the back of his remote? 🤣,neg,0.9999788,":pray:, :raised_hands:, :relaxed:, :blush:, :clap:, :relieved:, :kissing_heart:, :smile:, :heartbeat:, :heart:"
214,Anyone else having zero knowledge about IT and then got an understanding about what is API after seeing  this video ?,neg,0.9999491,":rage:, :angry:, :flushed:, :triumph:, :facepunch:, :grimacing:, :thumbsup:, :expressionless:, :confounded:, :muscle:"
215,"I choo choo choose to watch this course just   for the pun lines. JK!

I want to be like Craig Dennis when I Grow up lol 😂😂😂😂",pos,0.941272,":eyes:, :confused:, :smile:, :wink:, :grimacing:, :stuck_out_tongue_winking_eye:, :neutral_face:, :thumbsup:, :flushed:, :blush:"
216,"""Thank you for being inclusive. Inclusivity matters."" -Craig

Agreed! Really great and fun video. I'll be back for more.",pos,0.9949532,":rage:, :angry:, :confused:, :neutral_face:, :expressionless:, :disappointed:, :triumph:, :cry:, :grimacing:, :confounded:"
217,"This is just fantastic!!  APIs were so opaque to me.  Now I get it.  A lot clearer. And this is coming from someone who barely knows a line of code.  

Having said that, is there a crash course I can do that teaches me the bare basics of python needed to access APIs without having to learn the stuff that I won't use – if I'm just interested in accessing APIs?

Thanks again. :)",pos,0.99854714,":angry:, :rage:, :triumph:, :persevere:, :confounded:, :cry:, :disappointed:, :sweat:, :tired_face:, :expressionless:"
218,I completed the whole video and i absolutely loved it!!! thank you so much Craig for making it so much fun!!!!!!,pos,0.9983583,":thumbsup:, :eyes:, :sparkles:, :sunglasses:, :smile:, :flushed:, :heart_eyes:, :grimacing:, :sweat_smile:, :grin:"
219,"I just took a position at work and just started using APIs, this was write on time.  ""B.I.G"" shout out for the Hip Hop reference.",neg,0.78168947,":persevere:, :confounded:, :sweat:, :cry:, :disappointed:, :tired_face:, :pensive:, :sleepy:, :neutral_face:, :confused:"
220,"Hey, thanks for the tip in 0:35:45",pos,0.9149073,":joy:, :heart_eyes:, :sob:, :weary:, :heart:, :clap:, :relieved:, :blue_heart:, :raised_hands:, :skull:"
221,"Great tutorial, Big Poppa! 😂",pos,0.99730194,":expressionless:, :rage:, :sweat_smile:, :unamused:, :angry:, :neutral_face:, :gun:, :sob:, :disappointed:, :broken_heart:"
222,Today I learned that I was only taught about WEB API's and I thought that was what all API's were... so excited to get through this video!,pos,0.9998036,":heart:, :yellow_heart:, :blue_heart:, :purple_heart:, :heartbeat:, :smile:, :thumbsup:, :raised_hands:, :pray:, :clap:"
223,"Dissapointed that twilio doesn't work for my country, even you could say about it that there are countries that could test API twoards twilio.",neg,0.9999838,":pray:, :thumbsup:, :raised_hands:, :blush:, :clap:, :smile:, :heart:, :relaxed:, :yellow_heart:, :sparkling_heart:"
224,Great sense of humor!!! Subbed,pos,0.9976949,":sleepy:, :cry:, :sweat:, :angry:, :triumph:, :persevere:, :expressionless:, :sweat_smile:, :rage:, :gun:"
225,"When was thie video made?  The Spotify website changed and the layout is different.  Spotify seems to only have the ""Get"" request in the search API.  Can someone point me to the site that has the ""Request"" version of the API?",neg,0.9999945,":pray:, :grimacing:, :musical_note:, :grin:, :notes:, :relieved:, :relaxed:, :sweat_smile:, :see_no_evil:, :ok_hand:"
226,great tutorial for beginners,pos,0.9878209,":notes:, :musical_note:, :two_hearts:, :yellow_heart:, :heartbeat:, :heart:, :purple_heart:, :blue_heart:, :sparkling_heart:, :kissing_heart:"
227,"Please keep a constant level of volume and pronunciation. You drop off in volume and intelligibility at the end of each sentence, which makes it difficult to understand. If I am the ""only one"" to have pointed it out, it means that I am one of the few who watched long enough, and I am one of the few who actually wanted to understand you ... and, I have higher standards.",neg,0.99980503,":clap:, :heart_eyes:, :heartbeat:, :yellow_heart:, :blue_heart:, :heart:, :raised_hands:, :ok_hand:, :notes:, :musical_note:"
228,https://youtu.be/EBOq1xr0ieo,neg,0.5478433,":wink:, :thumbsup:, :smile:, :blush:, :relaxed:, :stuck_out_tongue_winking_eye:, :clap:, :grin:, :smirk:, :ok_hand:"
229,"This guy is so annoying. He knows his stuff and I need the information, and it's well-organized -- however his personality is so weird that I have to constantly rewind because his ""theater"" is so distracting from the information flow.  It absorbs 80% of my brain power just to cancel out the noise of his cringe mannerisms. His ""performance"" is like he's talking to 6 year old children, and he obviously thinks he's cute and entertaining. Hint: you're insulting the intelligence of your audience and I'd think even children would recognize this as b.s. ... Free Code Camp: just know that a rock star is somebody who can focus on delivering the goods, not somebody who thinks he is a Disney princess. You have a lot of great teachers but not this guy; he needs an education about the real world and to unplug from Sesame Street.. Craig: Here's one of many good examples of how to teach purely and simply, just delivering the information without injecting personality quirks. It's by an actual woman, not a guy pretending to be a woman or trying to ingratiate himself with women. Learn from her please.
https://www.youtube.com/watch?v=t8pPdKYpowI",neg,0.9999839,":cry:, :disappointed:, :persevere:, :pensive:, :sweat:, :angry:, :rage:, :confused:, :sleepy:, :tired_face:"
230,P!,neg,0.96177727,":eyes:, :flushed:, :confused:, :skull:, :neutral_face:, :sweat_smile:, :joy:, :persevere:, :weary:, :tired_face:"
231,It is an amazing video. It contains valuable and useful information. It motivates me. Thank you for this nice video,pos,0.9866094,":heartbeat:, :yellow_heart:, :sparkles:, :blue_heart:, :heart:, :relaxed:, :purple_heart:, :two_hearts:, :thumbsup:, :smile:"
232,"I have a problem,  I have Key 'To' but the output always says that Phone number is required, but I'd already put my phone number. please help me aSAP",neg,0.7149074,":yum:, :musical_note:, :heart_eyes:, :heartbeat:, :ok_hand:, :notes:, :smiling_imp:, :yellow_heart:, :sunglasses:, :raised_hands:"
233,"So annoying when these dweebs say ""she"" instead of ""he"" to show how progressive they are. How many women are writing code? But he's got to throw his politics into it.",neg,0.9998073,":v:, :musical_note:, :sunglasses:, :heartbeat:, :notes:, :muscle:, :relieved:, :ok_hand:, :yellow_heart:, :stuck_out_tongue_winking_eye:"
234,"amazing course, thank you so much. The content was great!",pos,0.97582895,":eyes:, :smirk:, :musical_note:, :clap:, :skull:, :notes:, :smiling_imp:, :flushed:, :ok_hand:, :speak_no_evil:"
235,25:19,pos,0.99414647,":flushed:, :confused:, :eyes:, :sweat_smile:, :joy:, :neutral_face:, :grimacing:, :smile:, :sweat:, :cry:"
236,24:11,pos,0.99097145,":yellow_heart:, :heart:, :heart_eyes:, :notes:, :musical_note:, :heartbeat:, :two_hearts:, :blue_heart:, :relieved:, :speak_no_evil:"
237,18:40,pos,0.9822343,":angry:, :rage:, :triumph:, :unamused:, :expressionless:, :neutral_face:, :mask:, :tired_face:, :sleepy:, :pensive:"
238,17:21,pos,0.9950942,":rage:, :angry:, :thumbsup:, :grimacing:, :confused:, :neutral_face:, :pray:, :wink:, :expressionless:, :confounded:"
239,1:07:32 how did you inserted emoji ? :O,neg,0.9997025,":thumbsup:, :sunglasses:, :smile:, :wink:, :blush:, :blue_heart:, :stuck_out_tongue_winking_eye:, :ok_hand:, :v:, :grin:"
