emojis, text
":rage:,:angry:,:confused:,:thumbsup:,:triumph:,:neutral_face:,:expressionless:,:grimacing:,:wink:,:stuck_out_tongue_winking_eye:", Yeah it's in the header where you can put some obscure code that the user doesn't see or has any idea of that it's there, you should know at least the basics of what's happening on the background of the API that you're using so you're able to recognize if the API is safe to use or that the API is giving unauthorized access to the server or the client.
Keep using API's the way you do and it's a matter of time that it goes horribly wrong, it's not a question of if it happens anymore because nowadays bad things happen to everyone who's doing things online.
You have been warned, what you do with this information is totally up to you.
One thing that I wouldn't teach or dare to say online is that you can use API's without knowing what happens in the background, that's bad advice so if you read this comment please don't listen to this guy, he may be able to use the API's but he has no idea what the API is capable of and what it can do without you even knowing or seeing anything that the API may be doing to your system or the server making it even more dangerous because if it sits somewhere on the server it can infect many computers, phones etc. and at the time that people finally begin to suspect that there's something wrong with their system it's already too late, who knows what happens if you don't have any knowledge of the inner workings of the API.
":thumbsup:,:sunglasses:,:smile:,:v:,:wink:,:stuck_out_tongue_winking_eye:,:blush:,:grin:,:relaxed:,:ok_hand:", hi Craig, you and the information you gave are awesome..
":pray:,:heartbeat:,:heart:,:yellow_heart:,:kissing_heart:,:blue_heart:,:two_hearts:,:relaxed:,:sparkling_heart:,:purple_heart:", Thank you so much  👍
":confused:,:neutral_face:,:angry:,:rage:,:expressionless:,:flushed:,:grimacing:,:see_no_evil:,:triumph:,:unamused:", when you started explaining postman i don't recall an explanation of 'why?'  Certainly not every dev or company uses postman? what are the negatives to using postman?
":gun:,:thumbsup:,:muscle:,:grimacing:,:sunglasses:,:information_desk_person:,:v:,:smile:,:grin:,:facepunch:", Get the notes and code for this course here: https://github.com/craigsdennis/intro-to-apis-course/blob/master/course-notes.md
